 报告日期,2018-12-31,2017-12-31,2016-12-31,2015-12-31,2014-12-31,2013-12-31,2012-12-31,2011-12-31, 
 销售商品、提供劳务收到的现金(万元),90325,71606,39698,33988,36527,34942,32761,26970, 
 客户存款和同业存放款项净增加额(万元),--,--,--,--,--,--,--,--, 
 向中央银行借款净增加额(万元,--,--,--,--,--,--,--,--, 
 向其他金融机构拆入资金净增加额(万元),--,--,--,--,--,--,--,--, 
 收到原保险合同保费取得的现金(万元),--,--,--,--,--,--,--,--, 
 收到再保险业务现金净额(万元),--,--,--,--,--,--,--,--, 
 保户储金及投资款净增加额(万元),--,--,--,--,--,--,--,--, 
 处置交易性金融资产净增加额(万元),--,--,--,--,--,--,--,--, 
 收取利息、手续费及佣金的现金(万元),--,--,--,--,--,--,--,--, 
 拆入资金净增加额(万元),--,--,--,--,--,--,--,--, 
 回购业务资金净增加额(万元),--,--,--,--,--,--,--,--, 
 收到的税费返还(万元),2,--,--,--,--,--,--,19, 
 收到的其他与经营活动有关的现金(万元),2730,1567,411,212,118,82,237,200, 
 经营活动现金流入小计(万元),93057,73172,40109,34200,36646,35023,32999,27189, 
 购买商品、接受劳务支付的现金(万元),58964,51688,22527,28410,20148,22923,18600,14296, 
 客户贷款及垫款净增加额(万元),--,--,--,--,--,--,--,--, 
 存放中央银行和同业款项净增加额(万元),--,--,--,--,--,--,--,--, 
 支付原保险合同赔付款项的现金(万元),--,--,--,--,--,--,--,--, 
 支付利息、手续费及佣金的现金(万元),--,--,--,--,--,--,--,--, 
 支付保单红利的现金(万元),--,--,--,--,--,--,--,--, 
 支付给职工以及为职工支付的现金(万元),7241,6380,3353,2942,2776,2699,2169,1882, 
 支付的各项税费(万元),5462,7766,2844,3213,3046,2867,2576,2490, 
 支付的其他与经营活动有关的现金(万元),11259,7528,5002,3549,3180,2618,2583,2171, 
 经营活动现金流出小计(万元),82926,73361,33726,38115,29151,31107,25929,20838, 
 经营活动产生的现金流量净额(万元),10131,-189,6383,-3915,7495,3916,7070,6351, 
 收回投资所收到的现金(万元),240,--,4000,--,--,--,--,--, 
 取得投资收益所收到的现金(万元),2,1,31,--,--,--,--,--, 
 处置固定资产、无形资产和其他长期资产所收回的现金净额(万元),1,9,0,38,--,1,0,--, 
 处置子公司及其他营业单位收到的现金净额(万元),--,--,--,--,--,--,--,--, 
 收到的其他与投资活动有关的现金(万元),--,--,--,--,--,--,--,--, 
 减少质押和定期存款所收到的现金(万元),--,--,--,--,--,--,--,--, 
 投资活动现金流入小计(万元),243,10,4031,38,0,1,0,0, 
 购建固定资产、无形资产和其他长期资产所支付的现金(万元),10478,13474,2202,16745,8987,4852,2218,3617, 
 投资所支付的现金(万元),12320,1250,--,--,--,--,--,--, 
 质押贷款净增加额(万元),--,--,--,--,--,--,--,--, 
 取得子公司及其他营业单位支付的现金净额(万元),--,--,37526,--,--,--,--,--, 
 支付的其他与投资活动有关的现金(万元),--,--,--,--,--,--,--,--, 
 增加质押和定期存款所支付的现金(万元),--,--,--,--,--,--,--,--, 
 投资活动现金流出小计(万元),22798,14724,39728,16745,8987,4852,2218,3617, 
 投资活动产生的现金流量净额(万元),-22555,-14714,-35697,-16708,-8987,-4851,-2218,-3617, 
 吸收投资收到的现金(万元),--,--,41460,25198,--,--,--,--, 
 其中：子公司吸收少数股东投资收到的现金(万元),--,--,--,--,--,--,--,--, 
 取得借款收到的现金(万元),35440,12381,610,9000,10200,5000,2100,3637, 
 发行债券收到的现金(万元),--,--,--,--,--,--,--,--, 
 收到其他与筹资活动有关的现金(万元),18,311,32,19,--,--,--,--, 
 筹资活动现金流入小计(万元),35458,12692,42102,34217,10200,5000,2100,3637, 
 偿还债务支付的现金(万元),12215,2240,6000,16381,2475,2494,2856,4144, 
 分配股利、利润或偿付利息所支付的现金(万元),3321,1775,1334,1496,4183,469,1026,187, 
 其中：子公司支付给少数股东的股利、利润(万元),--,--,--,--,--,--,--,--, 
 支付其他与筹资活动有关的现金(万元),917,897,223,569,40,62,187,178, 
 筹资活动现金流出小计(万元),16453,4912,7557,18447,6698,3024,4069,4508, 
 筹资活动产生的现金流量净额(万元),19005,7781,34545,15771,3502,1976,-1969,-871, 
 汇率变动对现金及现金等价物的影响(万元),0,-32,16,9,1,-16,-3,-2, 
 现金及现金等价物净增加额(万元),6580,-7155,5247,-4843,2011,1026,2879,1861, 
 加:期初现金及现金等价物余额(万元),4577,11732,6485,11328,9316,8291,5411,3551, 
 期末现金及现金等价物余额(万元),11157,4577,11732,6485,11328,9316,8291,5411, 
 净利润(万元),8380,2218,7701,5957,5797,5628,5010,--, 
 少数股东损益(万元),--,--,--,--,--,--,--,--, 
 未确认的投资损失(万元),--,--,--,--,--,--,--,--, 
 资产减值准备(万元),38936,15376,38,16,56,35,-11,--, 
 固定资产折旧、油气资产折耗、生产性物资折旧(万元),4670,3191,1901,808,645,667,517,--, 
 无形资产摊销(万元),568,574,263,155,119,84,72,--, 
 长期待摊费用摊销(万元),--,--,--,--,--,--,--,--, 
 待摊费用的减少(万元),--,--,--,--,--,--,--,--, 
 预提费用的增加(万元),--,--,--,--,--,--,--,--, 
 处置固定资产、无形资产和其他长期资产的损失(万元),0,19,2,63,--,1,-0,--, 
 固定资产报废损失(万元),41,23,--,--,--,--,--,--, 
 公允价值变动损失(万元),-39722,--,--,--,--,--,--,--, 
 递延收益增加(减：减少)(万元),--,--,--,--,--,--,--,--, 
 预计负债(万元),--,--,--,--,--,--,--,--, 
 财务费用(万元),985,467,133,135,215,231,282,--, 
 投资损失(万元),-6,2,-31,--,--,--,--,--, 
 递延所得税资产减少(万元),-160,-35,-37,31,18,-35,-1,--, 
 递延所得税负债增加(万元),3,1,0,--,--,--,--,--, 
 存货的减少(万元),-1621,-7052,202,-2337,-522,199,-8,--, 
 经营性应收项目的减少(万元),634,-24877,-5386,-7639,-417,-1778,316,--, 
 经营性应付项目的增加(万元),-2578,9903,1597,-1103,1584,-1115,893,--, 
 已完工尚未结算款的减少(减:增加)(万元),--,--,--,--,--,--,--,--, 
 已结算尚未完工款的增加(减:减少)(万元),--,--,--,--,--,--,--,--, 
 其他(万元),--,--,--,--,--,--,--,--, 
 经营活动产生现金流量净额(万元),10131,-189,6383,-3915,7495,3916,7070,--, 
 债务转为资本(万元),--,--,--,--,--,--,--,--, 
 一年内到期的可转换公司债券(万元),--,--,--,--,--,--,--,--, 
 融资租入固定资产(万元),--,--,--,--,--,--,--,--, 
 现金的期末余额(万元),11157,4577,11732,6485,11328,9316,8291,5411, 
 现金的期初余额(万元),4577,11732,6485,11328,9316,8291,5411,3551, 
 现金等价物的期末余额(万元),--,--,--,--,--,--,--,--, 
 现金等价物的期初余额(万元),--,--,--,--,--,--,--,--, 
 现金及现金等价物的净增加额(万元),6580,-7155,5247,-4843,2011,1026,2879,1861, 

