 报告日期,2018-12-31,2017-12-31,2016-12-31,2015-12-31,2014-12-31,2013-12-31,2012-12-31,2011-12-31, 
 销售商品、提供劳务收到的现金(万元),24097,16454,19157,17685,22381,15314,18790,11691, 
 客户存款和同业存放款项净增加额(万元),--,--,--,--,--,--,--,--, 
 向中央银行借款净增加额(万元,--,--,--,--,--,--,--,--, 
 向其他金融机构拆入资金净增加额(万元),--,--,--,--,--,--,--,--, 
 收到原保险合同保费取得的现金(万元),--,--,--,--,--,--,--,--, 
 收到再保险业务现金净额(万元),--,--,--,--,--,--,--,--, 
 保户储金及投资款净增加额(万元),--,--,--,--,--,--,--,--, 
 处置交易性金融资产净增加额(万元),--,--,--,--,--,--,--,--, 
 收取利息、手续费及佣金的现金(万元),--,--,--,--,--,--,--,--, 
 拆入资金净增加额(万元),--,--,--,--,--,--,--,--, 
 回购业务资金净增加额(万元),--,--,--,--,--,--,--,--, 
 收到的税费返还(万元),25,2,11,16,2,8,3,--, 
 收到的其他与经营活动有关的现金(万元),849,568,601,1189,1177,307,458,415, 
 经营活动现金流入小计(万元),24971,17024,19770,18891,23559,15629,19252,12106, 
 购买商品、接受劳务支付的现金(万元),13147,7248,9657,9409,10454,9147,7007,6116, 
 客户贷款及垫款净增加额(万元),--,--,--,--,--,--,--,--, 
 存放中央银行和同业款项净增加额(万元),--,--,--,--,--,--,--,--, 
 支付原保险合同赔付款项的现金(万元),--,--,--,--,--,--,--,--, 
 支付利息、手续费及佣金的现金(万元),--,--,--,--,--,--,--,--, 
 支付保单红利的现金(万元),--,--,--,--,--,--,--,--, 
 支付给职工以及为职工支付的现金(万元),3922,3862,4076,3780,3574,3125,2704,1687, 
 支付的各项税费(万元),1376,2184,2196,2912,1271,2909,2178,2348, 
 支付的其他与经营活动有关的现金(万元),3433,3328,2257,2648,2838,3956,2495,1575, 
 经营活动现金流出小计(万元),21878,16622,18187,18749,18136,19138,14384,11726, 
 经营活动产生的现金流量净额(万元),3093,402,1582,142,5423,-3508,4868,380, 
 收回投资所收到的现金(万元),--,--,--,--,--,--,--,--, 
 取得投资收益所收到的现金(万元),354,170,--,--,--,--,--,--, 
 处置固定资产、无形资产和其他长期资产所收回的现金净额(万元),0,0,0,--,0,1,27,0, 
 处置子公司及其他营业单位收到的现金净额(万元),--,--,--,--,--,--,--,--, 
 收到的其他与投资活动有关的现金(万元),56150,--,--,--,--,--,--,--, 
 减少质押和定期存款所收到的现金(万元),--,--,--,--,--,--,--,--, 
 投资活动现金流入小计(万元),56504,170,0,0,0,1,27,0, 
 购建固定资产、无形资产和其他长期资产所支付的现金(万元),2738,628,438,319,211,666,1131,154, 
 投资所支付的现金(万元),--,--,--,--,--,--,--,--, 
 质押贷款净增加额(万元),--,--,--,--,--,--,--,--, 
 取得子公司及其他营业单位支付的现金净额(万元),--,--,--,--,--,--,--,--, 
 支付的其他与投资活动有关的现金(万元),59800,8050,--,--,--,--,--,--, 
 增加质押和定期存款所支付的现金(万元),--,--,--,--,--,--,--,--, 
 投资活动现金流出小计(万元),62538,8678,438,319,211,666,1131,154, 
 投资活动产生的现金流量净额(万元),-6034,-8508,-438,-319,-211,-664,-1104,-154, 
 吸收投资收到的现金(万元),--,18694,--,--,--,--,--,3480, 
 其中：子公司吸收少数股东投资收到的现金(万元),--,--,--,--,--,--,--,--, 
 取得借款收到的现金(万元),--,--,--,--,--,1000,2200,1000, 
 发行债券收到的现金(万元),--,--,--,--,--,--,--,--, 
 收到其他与筹资活动有关的现金(万元),716,895,1408,1419,1828,1801,--,--, 
 筹资活动现金流入小计(万元),716,19589,1408,1419,1828,2801,2200,4480, 
 偿还债务支付的现金(万元),--,--,--,--,1000,--,2700,1000, 
 分配股利、利润或偿付利息所支付的现金(万元),480,1600,901,8,627,929,521,203, 
 其中：子公司支付给少数股东的股利、利润(万元),--,--,--,--,--,--,--,--, 
 支付其他与筹资活动有关的现金(万元),2550,2665,1089,1435,1867,704,1801,--, 
 筹资活动现金流出小计(万元),3030,4265,1990,1443,3495,1632,5023,1203, 
 筹资活动产生的现金流量净额(万元),-2315,15324,-581,-24,-1667,1169,-2823,3277, 
 汇率变动对现金及现金等价物的影响(万元),-6,--,--,--,--,0,-0,-0, 
 现金及现金等价物净增加额(万元),-5261,7218,563,-202,3545,-3003,941,3504, 
 加:期初现金及现金等价物余额(万元),14700,7482,6918,7120,3575,6578,5638,2134, 
 期末现金及现金等价物余额(万元),9439,14700,7482,6918,7120,3575,6578,5638, 
 净利润(万元),3677,3325,4008,3854,3702,2745,1986,1644, 
 少数股东损益(万元),--,--,--,--,--,--,--,--, 
 未确认的投资损失(万元),--,--,--,--,--,--,--,--, 
 资产减值准备(万元),686,321,562,209,79,45,14,78, 
 固定资产折旧、油气资产折耗、生产性物资折旧(万元),188,183,169,174,177,156,121,90, 
 无形资产摊销(万元),85,72,73,100,44,14,7,6, 
 长期待摊费用摊销(万元),2,5,5,5,5,3,0,--, 
 待摊费用的减少(万元),--,--,--,--,--,--,--,--, 
 预提费用的增加(万元),--,--,--,--,--,--,--,--, 
 处置固定资产、无形资产和其他长期资产的损失(万元),--,1,1,11,-0,-2,-10,-0, 
 固定资产报废损失(万元),0,--,--,--,--,--,--,--, 
 公允价值变动损失(万元),--,--,--,--,--,--,--,--, 
 递延收益增加(减：减少)(万元),--,--,--,--,--,--,--,--, 
 预计负债(万元),--,--,--,--,--,--,--,--, 
 财务费用(万元),--,--,1,8,12,11,65,38, 
 投资损失(万元),-354,-170,--,--,--,--,--,--, 
 递延所得税资产减少(万元),-103,-48,-84,-27,-12,-5,26,-40, 
 递延所得税负债增加(万元),--,--,--,--,--,--,--,--, 
 存货的减少(万元),-2841,-649,-458,324,2189,-1622,-2392,-925, 
 经营性应收项目的减少(万元),-2157,-6735,-2479,-3059,-207,-4126,532,-2871, 
 经营性应付项目的增加(万元),3909,4098,-215,-1457,-565,-729,4519,2361, 
 已完工尚未结算款的减少(减:增加)(万元),--,--,--,--,--,--,--,--, 
 已结算尚未完工款的增加(减:减少)(万元),--,--,--,--,--,--,--,--, 
 其他(万元),--,--,--,--,--,--,--,--, 
 经营活动产生现金流量净额(万元),3093,402,1582,142,5423,-3508,4868,380, 
 债务转为资本(万元),--,--,--,--,--,--,--,--, 
 一年内到期的可转换公司债券(万元),--,--,--,--,--,--,--,--, 
 融资租入固定资产(万元),--,--,--,--,--,--,--,--, 
 现金的期末余额(万元),9439,14700,7482,6918,7120,3575,6578,5638, 
 现金的期初余额(万元),14700,7482,6918,7120,3575,6578,5638,2134, 
 现金等价物的期末余额(万元),--,--,--,--,--,--,--,--, 
 现金等价物的期初余额(万元),--,--,--,--,--,--,--,--, 
 现金及现金等价物的净增加额(万元),-5261,7218,563,-202,3545,-3003,941,3504, 

