 报告日期,2018-12-31,2017-12-31,2016-12-31,2015-12-31,2014-12-31,2013-12-31,2012-12-31,2011-12-31, 
 销售商品、提供劳务收到的现金(万元),56917,65741,52452,48670,50836,25727,22853,17695, 
 客户存款和同业存放款项净增加额(万元),--,--,--,--,--,--,--,--, 
 向中央银行借款净增加额(万元,--,--,--,--,--,--,--,--, 
 向其他金融机构拆入资金净增加额(万元),--,--,--,--,--,--,--,--, 
 收到原保险合同保费取得的现金(万元),--,--,--,--,--,--,--,--, 
 收到再保险业务现金净额(万元),--,--,--,--,--,--,--,--, 
 保户储金及投资款净增加额(万元),--,--,--,--,--,--,--,--, 
 处置交易性金融资产净增加额(万元),--,--,--,--,--,--,--,--, 
 收取利息、手续费及佣金的现金(万元),--,--,--,--,--,--,--,--, 
 拆入资金净增加额(万元),--,--,--,--,--,--,--,--, 
 回购业务资金净增加额(万元),--,--,--,--,--,--,--,--, 
 收到的税费返还(万元),2282,3105,2880,2065,2316,1854,1744,871, 
 收到的其他与经营活动有关的现金(万元),1331,4427,3681,1921,1531,1467,769,396, 
 经营活动现金流入小计(万元),60530,73273,59013,52655,54683,29048,25366,18962, 
 购买商品、接受劳务支付的现金(万元),32064,38870,30129,23962,29429,16330,13298,8347, 
 客户贷款及垫款净增加额(万元),--,--,--,--,--,--,--,--, 
 存放中央银行和同业款项净增加额(万元),--,--,--,--,--,--,--,--, 
 支付原保险合同赔付款项的现金(万元),--,--,--,--,--,--,--,--, 
 支付利息、手续费及佣金的现金(万元),--,--,--,--,--,--,--,--, 
 支付保单红利的现金(万元),--,--,--,--,--,--,--,--, 
 支付给职工以及为职工支付的现金(万元),11860,9045,6818,5462,3936,3105,2792,1595, 
 支付的各项税费(万元),7633,8028,6602,8726,5811,6274,3992,2840, 
 支付的其他与经营活动有关的现金(万元),10070,8688,8842,6546,5228,3988,1946,2110, 
 经营活动现金流出小计(万元),61627,64631,52391,44696,44404,29697,22028,14892, 
 经营活动产生的现金流量净额(万元),-1097,8642,6622,7959,10280,-649,3338,4070, 
 收回投资所收到的现金(万元),219913,268399,338900,176709,13000,5000,--,7000, 
 取得投资收益所收到的现金(万元),1449,371,1226,678,67,35,--,88, 
 处置固定资产、无形资产和其他长期资产所收回的现金净额(万元),60,0,--,--,--,--,--,--, 
 处置子公司及其他营业单位收到的现金净额(万元),1470,1530,--,--,--,--,--,--, 
 收到的其他与投资活动有关的现金(万元),--,--,--,--,--,--,--,--, 
 减少质押和定期存款所收到的现金(万元),--,--,--,--,--,--,--,--, 
 投资活动现金流入小计(万元),222892,270300,340126,177387,13067,5035,0,7088, 
 购建固定资产、无形资产和其他长期资产所支付的现金(万元),557,254,2162,2965,63,302,1459,5761, 
 投资所支付的现金(万元),222911,332706,331650,185209,15500,5000,--,7000, 
 质押贷款净增加额(万元),--,--,--,--,--,--,--,--, 
 取得子公司及其他营业单位支付的现金净额(万元),--,--,230,130,--,--,--,--, 
 支付的其他与投资活动有关的现金(万元),--,--,--,--,--,--,--,--, 
 增加质押和定期存款所支付的现金(万元),--,--,--,--,--,--,--,--, 
 投资活动现金流出小计(万元),223468,332960,334042,188303,15563,5302,1459,12761, 
 投资活动产生的现金流量净额(万元),-576,-62660,6084,-10916,-2497,-267,-1459,-5674, 
 吸收投资收到的现金(万元),1477,6489,--,56427,--,--,--,--, 
 其中：子公司吸收少数股东投资收到的现金(万元),--,--,--,--,--,--,--,--, 
 取得借款收到的现金(万元),1350,140,--,--,--,2500,--,--, 
 发行债券收到的现金(万元),--,--,--,--,--,--,--,--, 
 收到其他与筹资活动有关的现金(万元),--,--,--,--,--,--,--,--, 
 筹资活动现金流入小计(万元),2827,6629,0,56427,0,2500,0,0, 
 偿还债务支付的现金(万元),50,140,--,--,2500,--,--,--, 
 分配股利、利润或偿付利息所支付的现金(万元),4327,4689,2912,2912,2541,1226,500,1200, 
 其中：子公司支付给少数股东的股利、利润(万元),--,--,--,--,--,--,--,--, 
 支付其他与筹资活动有关的现金(万元),8113,242,--,633,--,--,--,--, 
 筹资活动现金流出小计(万元),12490,5071,2912,3545,5041,1226,500,1200, 
 筹资活动产生的现金流量净额(万元),-9663,1558,-2912,52881,-5041,1274,-500,-1200, 
 汇率变动对现金及现金等价物的影响(万元),94,-106,93,30,-7,17,--,--, 
 现金及现金等价物净增加额(万元),-11242,-52567,9887,49954,2735,374,1379,-2803, 
 加:期初现金及现金等价物余额(万元),23881,75111,64932,14978,12243,11869,10490,13293, 
 期末现金及现金等价物余额(万元),12639,22545,74819,64932,14978,12243,11869,10490, 
 净利润(万元),10377,12145,13387,12823,10894,9403,8783,--, 
 少数股东损益(万元),--,--,--,--,--,--,--,--, 
 未确认的投资损失(万元),--,--,--,--,--,--,--,--, 
 资产减值准备(万元),1987,1370,2599,1654,1046,882,504,--, 
 固定资产折旧、油气资产折耗、生产性物资折旧(万元),1018,999,502,330,313,302,215,--, 
 无形资产摊销(万元),754,405,242,266,265,262,258,--, 
 长期待摊费用摊销(万元),--,--,--,--,--,--,--,--, 
 待摊费用的减少(万元),--,--,--,--,--,--,--,--, 
 预提费用的增加(万元),--,--,--,--,--,--,--,--, 
 处置固定资产、无形资产和其他长期资产的损失(万元),-0,6,--,--,--,-3,--,--, 
 固定资产报废损失(万元),6,1,0,1,0,0,5,--, 
 公允价值变动损失(万元),1,--,--,--,--,--,--,--, 
 递延收益增加(减：减少)(万元),--,--,--,--,--,--,--,--, 
 预计负债(万元),--,--,--,--,--,--,--,--, 
 财务费用(万元),-1208,-960,-731,-126,-55,-9,8,--, 
 投资损失(万元),-1070,-306,-309,-801,--,--,--,--, 
 递延所得税资产减少(万元),-752,-21,-347,-363,-93,-190,-183,--, 
 递延所得税负债增加(万元),-83,-35,--,--,--,--,--,--, 
 存货的减少(万元),-3587,7330,5944,-12450,-11633,112,-688,--, 
 经营性应收项目的减少(万元),-3563,2829,-19488,-7939,-150,-11721,-7988,--, 
 经营性应付项目的增加(万元),-4290,-15938,5401,15429,9591,521,2461,--, 
 已完工尚未结算款的减少(减:增加)(万元),--,--,--,--,--,--,--,--, 
 已结算尚未完工款的增加(减:减少)(万元),--,--,--,--,--,--,--,--, 
 其他(万元),-686,817,-578,-863,100,-208,-38,--, 
 经营活动产生现金流量净额(万元),-1097,8642,6622,7959,10280,-649,3338,--, 
 债务转为资本(万元),--,--,--,--,--,--,--,--, 
 一年内到期的可转换公司债券(万元),--,--,--,--,--,--,--,--, 
 融资租入固定资产(万元),--,--,--,--,--,--,--,--, 
 现金的期末余额(万元),12639,22545,74819,64932,14978,12243,11869,10490, 
 现金的期初余额(万元),23881,75111,64932,14978,12243,11869,10490,13293, 
 现金等价物的期末余额(万元),--,--,--,--,--,--,--,--, 
 现金等价物的期初余额(万元),--,--,--,--,--,--,--,--, 
 现金及现金等价物的净增加额(万元),-11242,-52567,9887,49954,2735,374,1379,-2803, 

