 报告日期,2018-12-31,2017-12-31,2016-12-31,2015-12-31,2014-12-31,2013-12-31,2012-12-31,2011-12-31, 
 销售商品、提供劳务收到的现金(万元),70836,54315,65436,54910,36812,28359,22983,21397, 
 客户存款和同业存放款项净增加额(万元),--,--,--,--,--,--,--,--, 
 向中央银行借款净增加额(万元,--,--,--,--,--,--,--,--, 
 向其他金融机构拆入资金净增加额(万元),--,--,--,--,--,--,--,--, 
 收到原保险合同保费取得的现金(万元),--,--,--,--,--,--,--,--, 
 收到再保险业务现金净额(万元),--,--,--,--,--,--,--,--, 
 保户储金及投资款净增加额(万元),--,--,--,--,--,--,--,--, 
 处置交易性金融资产净增加额(万元),--,--,--,--,--,--,--,--, 
 收取利息、手续费及佣金的现金(万元),--,--,--,--,--,--,--,--, 
 拆入资金净增加额(万元),--,--,--,--,--,--,--,--, 
 回购业务资金净增加额(万元),--,--,--,--,--,--,--,--, 
 收到的税费返还(万元),2281,2183,3005,3266,883,1730,710,473, 
 收到的其他与经营活动有关的现金(万元),4655,2625,2389,2201,1469,2449,1239,1784, 
 经营活动现金流入小计(万元),77771,59122,70829,60377,39165,32538,24931,23653, 
 购买商品、接受劳务支付的现金(万元),45933,36814,42260,31228,20673,17508,11716,12789, 
 客户贷款及垫款净增加额(万元),--,--,--,--,--,--,--,--, 
 存放中央银行和同业款项净增加额(万元),--,--,--,--,--,--,--,--, 
 支付原保险合同赔付款项的现金(万元),--,--,--,--,--,--,--,--, 
 支付利息、手续费及佣金的现金(万元),--,--,--,--,--,--,--,--, 
 支付保单红利的现金(万元),--,--,--,--,--,--,--,--, 
 支付给职工以及为职工支付的现金(万元),13649,12484,10131,7812,6786,5830,4449,2985, 
 支付的各项税费(万元),4665,4852,7465,4966,4006,3420,3770,2104, 
 支付的其他与经营活动有关的现金(万元),15997,12719,12182,7751,5729,4515,3781,3935, 
 经营活动现金流出小计(万元),80245,66869,72038,51756,37194,31274,23716,21814, 
 经营活动产生的现金流量净额(万元),-2473,-7746,-1209,8621,1971,1265,1215,1840, 
 收回投资所收到的现金(万元),24000,70000,--,--,270,1943,--,--, 
 取得投资收益所收到的现金(万元),107,236,--,--,1,1,9,9, 
 处置固定资产、无形资产和其他长期资产所收回的现金净额(万元),--,8,5,0,1,0,0,1, 
 处置子公司及其他营业单位收到的现金净额(万元),--,--,--,--,--,--,--,--, 
 收到的其他与投资活动有关的现金(万元),--,--,--,--,--,--,--,--, 
 减少质押和定期存款所收到的现金(万元),--,--,--,--,--,--,--,--, 
 投资活动现金流入小计(万元),24107,70244,5,0,272,1944,9,10, 
 购建固定资产、无形资产和其他长期资产所支付的现金(万元),2640,3901,2299,318,763,2383,3719,2639, 
 投资所支付的现金(万元),18582,75105,8000,--,--,--,--,--, 
 质押贷款净增加额(万元),--,--,--,--,--,--,--,--, 
 取得子公司及其他营业单位支付的现金净额(万元),--,--,--,--,--,--,--,--, 
 支付的其他与投资活动有关的现金(万元),--,--,--,--,--,--,--,--, 
 增加质押和定期存款所支付的现金(万元),--,--,--,--,--,--,--,--, 
 投资活动现金流出小计(万元),21221,79005,10299,318,763,2383,3719,2639, 
 投资活动产生的现金流量净额(万元),2885,-8761,-10294,-318,-491,-439,-3710,-2629, 
 吸收投资收到的现金(万元),391,2346,29208,--,--,--,--,8823, 
 其中：子公司吸收少数股东投资收到的现金(万元),391,--,--,--,--,--,--,--, 
 取得借款收到的现金(万元),17129,8900,12590,17288,13490,9000,5500,6000, 
 发行债券收到的现金(万元),--,--,--,--,--,--,--,--, 
 收到其他与筹资活动有关的现金(万元),--,--,--,--,--,570,--,--, 
 筹资活动现金流入小计(万元),17521,11246,41798,17288,13490,9570,5500,14823, 
 偿还债务支付的现金(万元),13910,3000,13900,19968,13500,7500,3000,6000, 
 分配股利、利润或偿付利息所支付的现金(万元),1348,2835,435,625,618,472,178,199, 
 其中：子公司支付给少数股东的股利、利润(万元),--,--,--,--,--,--,--,--, 
 支付其他与筹资活动有关的现金(万元),972,--,1107,272,266,260,408,3881, 
 筹资活动现金流出小计(万元),16230,5835,15442,20865,14384,8232,3586,10080, 
 筹资活动产生的现金流量净额(万元),1290,5411,26355,-3577,-894,1338,1914,4742, 
 汇率变动对现金及现金等价物的影响(万元),--,--,--,--,--,--,--,--, 
 现金及现金等价物净增加额(万元),1702,-11097,14853,4726,587,2163,-581,3953, 
 加:期初现金及现金等价物余额(万元),18597,29694,14841,10115,9529,7365,9942,5989, 
 期末现金及现金等价物余额(万元),20300,18597,29694,14841,10115,9529,9361,9942, 
 净利润(万元),619,3790,6935,6394,1433,5920,4569,4237, 
 少数股东损益(万元),--,--,--,--,--,--,--,--, 
 未确认的投资损失(万元),--,--,--,--,--,--,--,--, 
 资产减值准备(万元),1317,1781,1566,971,600,683,420,294, 
 固定资产折旧、油气资产折耗、生产性物资折旧(万元),1193,984,779,783,612,374,303,243, 
 无形资产摊销(万元),79,50,35,34,34,34,34,20, 
 长期待摊费用摊销(万元),107,11,--,--,--,--,--,--, 
 待摊费用的减少(万元),--,--,--,--,--,--,--,--, 
 预提费用的增加(万元),--,--,--,--,--,--,--,--, 
 处置固定资产、无形资产和其他长期资产的损失(万元),-9,-1,-3,1,1,1,1,0, 
 固定资产报废损失(万元),9,1,29,--,--,--,--,--, 
 公允价值变动损失(万元),--,--,--,--,--,--,--,--, 
 递延收益增加(减：减少)(万元),--,--,--,--,--,--,--,--, 
 预计负债(万元),--,--,--,--,--,--,--,--, 
 财务费用(万元),602,-68,472,741,700,638,269,258, 
 投资损失(万元),225,-69,--,--,-265,-1870,-9,-9, 
 递延所得税资产减少(万元),-832,-255,-206,-150,-89,-189,-64,-48, 
 递延所得税负债增加(万元),--,--,--,--,--,--,--,--, 
 存货的减少(万元),-6233,3361,-2900,-4035,-3170,-1914,2459,2195, 
 经营性应收项目的减少(万元),-8391,-15786,-11136,-6215,-2377,-6587,-6272,-5786, 
 经营性应付项目的增加(万元),8745,-1780,3222,10097,4493,4174,-495,436, 
 已完工尚未结算款的减少(减:增加)(万元),--,--,--,--,--,--,--,--, 
 已结算尚未完工款的增加(减:减少)(万元),--,--,--,--,--,--,--,--, 
 其他(万元),95,235,--,--,--,--,--,--, 
 经营活动产生现金流量净额(万元),-2473,-7746,-1209,8621,1971,1265,1215,1840, 
 债务转为资本(万元),--,--,--,--,--,--,--,--, 
 一年内到期的可转换公司债券(万元),--,--,--,--,--,--,--,--, 
 融资租入固定资产(万元),--,--,--,--,--,--,--,--, 
 现金的期末余额(万元),20300,18597,29694,14841,10115,9529,9361,9942, 
 现金的期初余额(万元),18597,29694,14841,10115,9529,7365,9942,5989, 
 现金等价物的期末余额(万元),--,--,--,--,--,--,--,--, 
 现金等价物的期初余额(万元),--,--,--,--,--,--,--,--, 
 现金及现金等价物的净增加额(万元),1702,-11097,14853,4726,587,2163,-581,3953, 

