 报告日期,2018-12-31,2017-12-31,2016-12-31,2015-12-31,2014-12-31,2013-12-31, 
 销售商品、提供劳务收到的现金(万元),95486,91595,81835,67295,51678,47457, 
 客户存款和同业存放款项净增加额(万元),--,--,--,--,--,--, 
 向中央银行借款净增加额(万元,--,--,--,--,--,--, 
 向其他金融机构拆入资金净增加额(万元),--,--,--,--,--,--, 
 收到原保险合同保费取得的现金(万元),--,--,--,--,--,--, 
 收到再保险业务现金净额(万元),--,--,--,--,--,--, 
 保户储金及投资款净增加额(万元),--,--,--,--,--,--, 
 处置交易性金融资产净增加额(万元),--,--,--,--,--,--, 
 收取利息、手续费及佣金的现金(万元),--,--,--,--,--,--, 
 拆入资金净增加额(万元),--,--,--,--,--,--, 
 回购业务资金净增加额(万元),--,--,--,--,--,--, 
 收到的税费返还(万元),--,--,--,--,--,--, 
 收到的其他与经营活动有关的现金(万元),1387,946,1168,581,1859,1694, 
 经营活动现金流入小计(万元),96874,92541,83003,67876,53537,49151, 
 购买商品、接受劳务支付的现金(万元),59132,48070,41602,33844,30487,25801, 
 客户贷款及垫款净增加额(万元),--,--,--,--,--,--, 
 存放中央银行和同业款项净增加额(万元),--,--,--,--,--,--, 
 支付原保险合同赔付款项的现金(万元),--,--,--,--,--,--, 
 支付利息、手续费及佣金的现金(万元),--,--,--,--,--,--, 
 支付保单红利的现金(万元),--,--,--,--,--,--, 
 支付给职工以及为职工支付的现金(万元),18883,17033,15444,11945,10040,8225, 
 支付的各项税费(万元),6737,7583,5431,4912,3779,3976, 
 支付的其他与经营活动有关的现金(万元),9223,8846,8562,6471,6835,7055, 
 经营活动现金流出小计(万元),93975,81532,71039,57173,51142,45058, 
 经营活动产生的现金流量净额(万元),2899,11009,11964,10703,2395,4093, 
 收回投资所收到的现金(万元),526,--,--,--,--,--, 
 取得投资收益所收到的现金(万元),--,--,--,--,441,--, 
 处置固定资产、无形资产和其他长期资产所收回的现金净额(万元),10,53,46,56,1,169, 
 处置子公司及其他营业单位收到的现金净额(万元),--,4173,--,--,-441,--, 
 收到的其他与投资活动有关的现金(万元),62132,75929,11616,33700,0,336, 
 减少质押和定期存款所收到的现金(万元),--,--,--,--,--,--, 
 投资活动现金流入小计(万元),62669,80155,11662,33756,1,505, 
 购建固定资产、无形资产和其他长期资产所支付的现金(万元),3898,4239,6528,5964,5586,4563, 
 投资所支付的现金(万元),5000,--,--,--,--,--, 
 质押贷款净增加额(万元),--,--,--,--,--,--, 
 取得子公司及其他营业单位支付的现金净额(万元),--,--,--,--,--,--, 
 支付的其他与投资活动有关的现金(万元),77000,75860,11600,33650,--,--, 
 增加质押和定期存款所支付的现金(万元),--,--,--,--,--,--, 
 投资活动现金流出小计(万元),85898,80099,18128,39614,5586,4563, 
 投资活动产生的现金流量净额(万元),-23229,55,-6466,-5859,-5585,-4058, 
 吸收投资收到的现金(万元),32903,--,1122,--,--,--, 
 其中：子公司吸收少数股东投资收到的现金(万元),--,--,10,--,--,--, 
 取得借款收到的现金(万元),5737,11179,17129,17414,25404,17655, 
 发行债券收到的现金(万元),--,--,--,--,--,--, 
 收到其他与筹资活动有关的现金(万元),--,--,--,--,--,--, 
 筹资活动现金流入小计(万元),38640,11179,18251,17414,25404,17655, 
 偿还债务支付的现金(万元),12142,15606,21707,19671,19586,16295, 
 分配股利、利润或偿付利息所支付的现金(万元),313,1407,964,1289,1132,2178, 
 其中：子公司支付给少数股东的股利、利润(万元),--,--,--,--,--,--, 
 支付其他与筹资活动有关的现金(万元),1493,--,--,--,1478,490, 
 筹资活动现金流出小计(万元),13948,17013,22671,20960,22196,18963, 
 筹资活动产生的现金流量净额(万元),24691,-5834,-4420,-3546,3208,-1308, 
 汇率变动对现金及现金等价物的影响(万元),--,--,--,--,--,--, 
 现金及现金等价物净增加额(万元),4361,5230,1077,1298,18,-1273, 
 加:期初现金及现金等价物余额(万元),14032,8802,7725,6427,6409,7682, 
 期末现金及现金等价物余额(万元),18393,14032,8802,7725,6427,6409, 
 净利润(万元),7652,7430,4042,1888,427,692, 
 少数股东损益(万元),--,--,--,--,--,--, 
 未确认的投资损失(万元),--,--,--,--,--,--, 
 资产减值准备(万元),664,490,-71,187,411,443, 
 固定资产折旧、油气资产折耗、生产性物资折旧(万元),2132,2174,1983,1624,1385,1370, 
 无形资产摊销(万元),295,284,256,238,229,213, 
 长期待摊费用摊销(万元),805,918,710,638,401,297, 
 待摊费用的减少(万元),--,--,--,--,--,--, 
 预提费用的增加(万元),--,--,--,--,--,--, 
 处置固定资产、无形资产和其他长期资产的损失(万元),2,50,1,71,-1,-13, 
 固定资产报废损失(万元),--,--,--,--,--,-0, 
 公允价值变动损失(万元),--,--,--,--,--,--, 
 递延收益增加(减：减少)(万元),--,--,--,--,--,--, 
 预计负债(万元),--,--,--,--,--,--, 
 财务费用(万元),313,681,905,1090,1132,978, 
 投资损失(万元),-132,-1348,-16,-50,--,--, 
 递延所得税资产减少(万元),-72,2,57,85,58,-228, 
 递延所得税负债增加(万元),--,--,--,--,--,--, 
 存货的减少(万元),-5472,64,1373,973,-2978,-1733, 
 经营性应收项目的减少(万元),-2027,-2477,-2684,1867,-534,1263, 
 经营性应付项目的增加(万元),-1394,2039,5259,2018,1986,812, 
 已完工尚未结算款的减少(减:增加)(万元),--,--,--,--,--,--, 
 已结算尚未完工款的增加(减:减少)(万元),--,--,--,--,--,--, 
 其他(万元),132,702,150,74,-122,-3, 
 经营活动产生现金流量净额(万元),2899,11009,11964,10703,2395,4093, 
 债务转为资本(万元),--,--,--,--,--,--, 
 一年内到期的可转换公司债券(万元),--,--,--,--,--,--, 
 融资租入固定资产(万元),--,--,--,--,--,--, 
 现金的期末余额(万元),18393,14032,8802,7725,6427,6409, 
 现金的期初余额(万元),14032,8802,7725,6427,6409,7682, 
 现金等价物的期末余额(万元),--,--,--,--,--,--, 
 现金等价物的期初余额(万元),--,--,--,--,--,--, 
 现金及现金等价物的净增加额(万元),4361,5230,1077,1298,18,-1273, 

