 报告日期,2018-12-31,2017-12-31,2016-12-31,2015-12-31,2014-12-31,2013-12-31,2012-12-31, 
 销售商品、提供劳务收到的现金(万元),928998,813117,723038,734810,744952,633006,446915, 
 客户存款和同业存放款项净增加额(万元),--,--,--,--,--,--,--, 
 向中央银行借款净增加额(万元,--,--,--,--,--,--,--, 
 向其他金融机构拆入资金净增加额(万元),--,--,--,--,--,--,--, 
 收到原保险合同保费取得的现金(万元),--,--,--,--,--,--,--, 
 收到再保险业务现金净额(万元),--,--,--,--,--,--,--, 
 保户储金及投资款净增加额(万元),--,--,--,--,--,--,--, 
 处置交易性金融资产净增加额(万元),--,--,--,--,--,--,--, 
 收取利息、手续费及佣金的现金(万元),--,--,--,--,--,--,--, 
 拆入资金净增加额(万元),--,--,--,--,--,--,--, 
 回购业务资金净增加额(万元),--,--,--,--,--,--,--, 
 收到的税费返还(万元),6774,1629,2903,4406,16367,11876,15806, 
 收到的其他与经营活动有关的现金(万元),54684,38681,37000,31140,29061,31357,50702, 
 经营活动现金流入小计(万元),990456,853427,762941,770355,790381,676238,513423, 
 购买商品、接受劳务支付的现金(万元),599476,537654,442571,478751,501972,410503,237520, 
 客户贷款及垫款净增加额(万元),--,--,--,--,--,--,--, 
 存放中央银行和同业款项净增加额(万元),--,--,--,--,--,--,--, 
 支付原保险合同赔付款项的现金(万元),--,--,--,--,--,--,--, 
 支付利息、手续费及佣金的现金(万元),--,--,--,--,--,--,--, 
 支付保单红利的现金(万元),--,--,--,--,--,--,--, 
 支付给职工以及为职工支付的现金(万元),132585,116399,103905,96203,86334,78858,79040, 
 支付的各项税费(万元),15428,17419,18725,17967,19230,27398,35559, 
 支付的其他与经营活动有关的现金(万元),91245,115990,81140,99085,94601,85692,125185, 
 经营活动现金流出小计(万元),838733,787461,646342,692007,702137,602451,477304, 
 经营活动产生的现金流量净额(万元),151724,65966,116600,78349,88244,73787,36119, 
 收回投资所收到的现金(万元),235000,74250,96270,63000,272000,610101,182000, 
 取得投资收益所收到的现金(万元),4999,2535,2380,2480,1635,2296,529, 
 处置固定资产、无形资产和其他长期资产所收回的现金净额(万元),1963,509,1948,122,544,175,502, 
 处置子公司及其他营业单位收到的现金净额(万元),--,--,--,--,--,--,20, 
 收到的其他与投资活动有关的现金(万元),10,25,--,422,756,8338,2006, 
 减少质押和定期存款所收到的现金(万元),--,--,--,--,--,--,--, 
 投资活动现金流入小计(万元),241972,77319,100599,66024,274935,620911,185056, 
 购建固定资产、无形资产和其他长期资产所支付的现金(万元),55595,40330,25009,20950,34438,8398,16757, 
 投资所支付的现金(万元),398100,63394,100270,68000,289600,627000,227000, 
 质押贷款净增加额(万元),--,--,--,--,--,--,--, 
 取得子公司及其他营业单位支付的现金净额(万元),--,--,--,235,--,--,--, 
 支付的其他与投资活动有关的现金(万元),--,0,127,--,--,9370,--, 
 增加质押和定期存款所支付的现金(万元),--,--,--,--,--,--,--, 
 投资活动现金流出小计(万元),453695,103724,125406,89185,324038,644768,243757, 
 投资活动产生的现金流量净额(万元),-211723,-26406,-24807,-23162,-49103,-23856,-58701, 
 吸收投资收到的现金(万元),--,262984,1000,--,--,34807,16799, 
 其中：子公司吸收少数股东投资收到的现金(万元),--,120,400,--,--,--,--, 
 取得借款收到的现金(万元),--,--,--,193,10298,3543,2704, 
 发行债券收到的现金(万元),--,--,--,--,--,--,--, 
 收到其他与筹资活动有关的现金(万元),4272,2697,9484,4280,8000,3683,4130, 
 筹资活动现金流入小计(万元),4272,265681,10484,4473,18298,42033,23633, 
 偿还债务支付的现金(万元),--,--,193,--,10305,3543,28278, 
 分配股利、利润或偿付利息所支付的现金(万元),46509,40197,66924,13260,38085,5000,432, 
 其中：子公司支付给少数股东的股利、利润(万元),--,--,--,--,--,--,--, 
 支付其他与筹资活动有关的现金(万元),2034,5641,1572,2273,--,49,112, 
 筹资活动现金流出小计(万元),48543,45838,68689,15533,48390,8592,28822, 
 筹资活动产生的现金流量净额(万元),-44271,219843,-58205,-11059,-30092,33441,-5189, 
 汇率变动对现金及现金等价物的影响(万元),126,-36,19,60,33,-3,7, 
 现金及现金等价物净增加额(万元),-104144,259368,33607,44188,9082,83369,-27764, 
 加:期初现金及现金等价物余额(万元),605080,345712,312106,267918,258836,175467,203231, 
 期末现金及现金等价物余额(万元),500936,605080,345712,312106,267918,258836,175467, 
 净利润(万元),147574,135900,104749,98408,93473,--,--, 
 少数股东损益(万元),--,--,--,--,--,--,--, 
 未确认的投资损失(万元),--,--,--,--,--,--,--, 
 资产减值准备(万元),4023,6905,7744,3355,7600,--,--, 
 固定资产折旧、油气资产折耗、生产性物资折旧(万元),15470,14034,13586,13284,13683,--,--, 
 无形资产摊销(万元),2996,2807,2569,2484,2083,--,--, 
 长期待摊费用摊销(万元),4176,3164,1639,1168,654,--,--, 
 待摊费用的减少(万元),--,--,--,--,--,--,--, 
 预提费用的增加(万元),--,--,--,--,--,--,--, 
 处置固定资产、无形资产和其他长期资产的损失(万元),-1548,127,-125,18,-279,--,--, 
 固定资产报废损失(万元),187,124,30,6,0,--,--, 
 公允价值变动损失(万元),--,--,--,--,--,--,--, 
 递延收益增加(减：减少)(万元),--,--,--,--,--,--,--, 
 预计负债(万元),--,--,--,--,--,--,--, 
 财务费用(万元),526,199,63,30,143,--,--, 
 投资损失(万元),-4826,-2241,-2356,-2444,-1636,--,--, 
 递延所得税资产减少(万元),-137,-339,195,-37,-75,--,--, 
 递延所得税负债增加(万元),-87,-111,-136,-418,-57,--,--, 
 存货的减少(万元),-21448,-22836,16648,-10203,-15319,--,--, 
 经营性应收项目的减少(万元),885,-37878,180,-1296,55764,--,--, 
 经营性应付项目的增加(万元),3931,-33889,-28187,-26007,-67790,--,--, 
 已完工尚未结算款的减少(减:增加)(万元),--,--,--,--,--,--,--, 
 已结算尚未完工款的增加(减:减少)(万元),--,--,--,--,--,--,--, 
 其他(万元),--,--,--,--,--,--,--, 
 经营活动产生现金流量净额(万元),151724,65966,116600,78349,88244,--,--, 
 债务转为资本(万元),--,--,--,--,--,--,--, 
 一年内到期的可转换公司债券(万元),--,--,--,--,--,--,--, 
 融资租入固定资产(万元),--,--,--,--,--,--,--, 
 现金的期末余额(万元),500936,605080,345712,312106,267918,258836,175467, 
 现金的期初余额(万元),605080,345712,312106,267918,258836,175467,203231, 
 现金等价物的期末余额(万元),--,--,--,--,--,--,--, 
 现金等价物的期初余额(万元),--,--,--,--,--,--,--, 
 现金及现金等价物的净增加额(万元),-104144,259368,33607,44188,9082,83369,-27764, 

