 报告日期,2018-12-31,2017-12-31,2016-12-31,2015-12-31,2014-12-31,2013-12-31,2012-12-31,2011-12-31, 
 销售商品、提供劳务收到的现金(万元),68776,84881,72575,75350,80538,72805,82788,75439, 
 客户存款和同业存放款项净增加额(万元),--,--,--,--,--,--,--,--, 
 向中央银行借款净增加额(万元,--,--,--,--,--,--,--,--, 
 向其他金融机构拆入资金净增加额(万元),--,--,--,--,--,--,--,--, 
 收到原保险合同保费取得的现金(万元),--,--,--,--,--,--,--,--, 
 收到再保险业务现金净额(万元),--,--,--,--,--,--,--,--, 
 保户储金及投资款净增加额(万元),--,--,--,--,--,--,--,--, 
 处置交易性金融资产净增加额(万元),--,--,--,--,--,--,--,--, 
 收取利息、手续费及佣金的现金(万元),--,--,--,--,--,--,--,--, 
 拆入资金净增加额(万元),--,--,--,--,--,--,--,--, 
 回购业务资金净增加额(万元),--,--,--,--,--,--,--,--, 
 收到的税费返还(万元),168,239,212,139,134,127,220,--, 
 收到的其他与经营活动有关的现金(万元),1148,408,396,349,713,1976,3205,2391, 
 经营活动现金流入小计(万元),70092,85528,73183,75838,81385,74908,86212,77830, 
 购买商品、接受劳务支付的现金(万元),35269,48109,35171,28867,25816,29813,37142,30451, 
 客户贷款及垫款净增加额(万元),--,--,--,--,--,--,--,--, 
 存放中央银行和同业款项净增加额(万元),--,--,--,--,--,--,--,--, 
 支付原保险合同赔付款项的现金(万元),--,--,--,--,--,--,--,--, 
 支付利息、手续费及佣金的现金(万元),--,--,--,--,--,--,--,--, 
 支付保单红利的现金(万元),--,--,--,--,--,--,--,--, 
 支付给职工以及为职工支付的现金(万元),8591,8406,8199,8151,8630,9926,8941,8091, 
 支付的各项税费(万元),11815,14454,15882,16902,12974,12821,17439,18766, 
 支付的其他与经营活动有关的现金(万元),9405,8187,7839,6448,8240,9420,10563,9706, 
 经营活动现金流出小计(万元),65081,79157,67091,60369,55660,61980,74086,67014, 
 经营活动产生的现金流量净额(万元),5012,6371,6092,15469,25726,12928,12127,10815, 
 收回投资所收到的现金(万元),--,--,--,--,--,--,--,--, 
 取得投资收益所收到的现金(万元),8,--,--,--,--,--,--,--, 
 处置固定资产、无形资产和其他长期资产所收回的现金净额(万元),18,18,89,16,8,69,274,632, 
 处置子公司及其他营业单位收到的现金净额(万元),--,--,--,--,--,--,--,--, 
 收到的其他与投资活动有关的现金(万元),11600,69,642,638,--,--,20,--, 
 减少质押和定期存款所收到的现金(万元),--,--,--,--,--,--,--,--, 
 投资活动现金流入小计(万元),11626,87,731,655,8,69,294,632, 
 购建固定资产、无形资产和其他长期资产所支付的现金(万元),27219,11870,10348,3198,1504,3533,5151,8538, 
 投资所支付的现金(万元),--,--,--,--,--,--,--,--, 
 质押贷款净增加额(万元),--,--,--,--,--,--,--,--, 
 取得子公司及其他营业单位支付的现金净额(万元),--,--,--,--,--,--,23,--, 
 支付的其他与投资活动有关的现金(万元),11600,--,--,--,--,--,--,--, 
 增加质押和定期存款所支付的现金(万元),--,--,--,--,--,--,--,--, 
 投资活动现金流出小计(万元),38819,11870,10348,3198,1504,3533,5173,8538, 
 投资活动产生的现金流量净额(万元),-27193,-11783,-9618,-2544,-1496,-3464,-4880,-7906, 
 吸收投资收到的现金(万元),--,56348,20142,--,--,--,--,--, 
 其中：子公司吸收少数股东投资收到的现金(万元),--,--,--,--,--,--,--,--, 
 取得借款收到的现金(万元),60956,59252,66490,81494,96699,102841,85629,74256, 
 发行债券收到的现金(万元),--,--,--,--,--,--,--,--, 
 收到其他与筹资活动有关的现金(万元),26,200,12,--,--,--,--,--, 
 筹资活动现金流入小计(万元),60982,115800,86645,81494,96699,102841,85629,74256, 
 偿还债务支付的现金(万元),43667,90046,77679,93030,116758,104168,85058,56380, 
 分配股利、利润或偿付利息所支付的现金(万元),3643,4113,2654,3369,5082,5744,8689,10834, 
 其中：子公司支付给少数股东的股利、利润(万元),--,--,--,--,--,--,--,--, 
 支付其他与筹资活动有关的现金(万元),185,1840,828,39,43,18,484,6290, 
 筹资活动现金流出小计(万元),47495,95998,81161,96438,121883,109929,94231,73504, 
 筹资活动产生的现金流量净额(万元),13487,19801,5484,-14944,-25184,-7089,-8602,752, 
 汇率变动对现金及现金等价物的影响(万元),-317,-73,8,--,--,--,--,--, 
 现金及现金等价物净增加额(万元),-9011,14315,1967,-2019,-954,2375,-1355,3661, 
 加:期初现金及现金等价物余额(万元),21962,7647,5680,7700,8654,6279,7634,3973, 
 期末现金及现金等价物余额(万元),12951,21962,7647,5680,7700,8654,6279,7634, 
 净利润(万元),5164,6347,5879,4181,3529,3541,--,--, 
 少数股东损益(万元),--,--,--,--,--,--,--,--, 
 未确认的投资损失(万元),--,--,--,--,--,--,--,--, 
 资产减值准备(万元),504,480,766,373,318,199,--,--, 
 固定资产折旧、油气资产折耗、生产性物资折旧(万元),4803,4851,4190,4157,3860,3723,--,--, 
 无形资产摊销(万元),122,122,122,122,122,122,--,--, 
 长期待摊费用摊销(万元),210,219,268,306,231,593,--,--, 
 待摊费用的减少(万元),--,--,--,--,--,--,--,--, 
 预提费用的增加(万元),--,--,--,--,--,--,--,--, 
 处置固定资产、无形资产和其他长期资产的损失(万元),101,123,82,-10,53,-40,--,--, 
 固定资产报废损失(万元),60,17,1,41,3,--,--,--, 
 公允价值变动损失(万元),--,--,--,--,--,--,--,--, 
 递延收益增加(减：减少)(万元),--,--,--,--,--,--,--,--, 
 预计负债(万元),--,--,--,--,--,--,--,--, 
 财务费用(万元),1155,2358,2656,4769,6128,6180,--,--, 
 投资损失(万元),-8,--,--,--,--,--,--,--, 
 递延所得税资产减少(万元),-785,-55,303,-23,-878,-376,--,--, 
 递延所得税负债增加(万元),-275,275,--,--,--,-26,--,--, 
 存货的减少(万元),-6791,-9871,-4164,703,5308,-6368,--,--, 
 经营性应收项目的减少(万元),-2766,-3990,-1609,2500,5142,2551,--,--, 
 经营性应付项目的增加(万元),3622,5479,-2401,-1649,1909,2829,--,--, 
 已完工尚未结算款的减少(减:增加)(万元),--,--,--,--,--,--,--,--, 
 已结算尚未完工款的增加(减:减少)(万元),--,--,--,--,--,--,--,--, 
 其他(万元),-103,16,--,--,--,--,--,--, 
 经营活动产生现金流量净额(万元),5012,6371,6092,15469,25726,12928,--,--, 
 债务转为资本(万元),--,--,--,--,--,--,--,--, 
 一年内到期的可转换公司债券(万元),--,--,--,--,--,--,--,--, 
 融资租入固定资产(万元),--,--,--,--,--,--,--,--, 
 现金的期末余额(万元),12951,21962,7647,5680,7700,8654,6279,7634, 
 现金的期初余额(万元),21962,7647,5680,7700,8654,6279,7634,3973, 
 现金等价物的期末余额(万元),--,--,--,--,--,--,--,--, 
 现金等价物的期初余额(万元),--,--,--,--,--,--,--,--, 
 现金及现金等价物的净增加额(万元),-9011,14315,1967,-2019,-954,2375,-1355,3661, 

